Name,Address,Rating,Website,Price,City,State
The Manhattan at Times Square Hotel,"790 7th Ave, New York, NY 10019, USA",3.1,https://www.ihg.com/spnd/hotels/us/en/new-york/nycat/hoteldetail,570,New York City,NY
"Holiday Inn New York City - Times Square, an IHG Hotel","585 8th Ave, New York, NY 10018, USA",4.1,https://www.ihg.com/holidayinn/hotels/us/en/new-york/nycma/hoteldetail?cm_mmc=GoogleMaps-_-HI-_-US-_-NYCMA,250,New York City,NY
Delta Hotels New York Times Square,"340 W 40th St, New York, NY 10018, USA",3.3,https://www.marriott.com/en-us/hotels/nycde-delta-hotels-new-york-times-square/overview/?scid=f2ae0541-1279-4f24-b197-a979c79310b0,220,New York City,NY
The New Yorker Hotel,"481 8th Ave, New York, NY 10001, USA",3.9,https://www.wyndhamhotels.travel/,290,New York City,NY
Park Central Hotel New York,"870 7th Ave, New York, NY 10019, USA",3.9,http://www.parkcentralny.com/,236,New York City,NY
DoubleTree by Hilton Hotel New York Times Square West,"350 W 40th St, New York, NY 10018, USA",3.5,https://www.hilton.com/en/hotels/nycswdt-doubletree-new-york-times-square-west/?SEO_id=GMB-AMER-DT-NYCSWDT&y_source=1_NDQ2NjAzNi03MTUtbG9jYXRpb24ud2Vic2l0ZQ%3D%3D,125,New York City,NY
SpringHill Suites New York Manhattan/Times Square South,"338 W 36th St., New York, NY 10018, USA",3.9,https://www.marriott.com/en-us/hotels/nycsh-springhill-suites-new-york-manhattan-times-square-south/overview/?scid=f2ae0541-1279-4f24-b197-a979c79310b0,150,New York City,NY
Virgin Hotels New York City,"1227 Broadway, New York, NY 10001, USA",4,https://virginhotels.com/nyc/,198,New York City,NY
Hyatt Grand Central New York,"at Grand Central Terminal, 109 E 42nd St, New York, NY 10017, USA",4,https://www.hyatt.com/en-US/hotel/new-york/hyatt-grand-central-new-york/nycgh?src=corp_lclb_google_seo_nycgh&%3Futm_source=google&utm_medium=organic&utm_campaign=lmr,157,New York City,NY
Graduate by Hilton New York,"22 N Loop Rd, New York, NY 10044, USA",4.1,https://www.hilton.com/en/hotels/nycgngu-graduate-new-york/?SEO_id=GMB-AMER-GU-NYCGNGU&y_source=1_MTA1MzY0NDc0MS03MTUtbG9jYXRpb24ud2Vic2l0ZQ%3D%3D,86,New York City,NY
Freehand Los Angeles,"416 W 8th St, Los Angeles, CA 90014, USA",4.1,https://freehandhotels.com/los-angeles/?utm_source=google-my-business&utm_medium=organic&utm_campaign=hotel-los-angeles,148,Los Angeles,CA
citizenM Los Angeles Downtown hotel,"361 S Spring St, Los Angeles, CA 90013, USA",4.4,https://www.citizenm.com/hotels/united-states/los-angeles/los-angeles-downtown-hotel?utm_source=google&utm_medium=organic&utm_campaign=gbp&utm_content=lad&y_source=1_NDkyNzM5MTUtNzE1LWxvY2F0aW9uLndlYnNpdGU%3D,193,Los Angeles,CA
Hollywood Hotel ®,"District of Hollywood, 1160 N Vermont Ave, Los Angeles, CA 90029, USA",3.6,https://www.thehollywoodhotel.com/,120,Los Angeles,CA
STILE Downtown Los Angeles by Kasa,"929 S Broadway, Los Angeles, CA 90015, USA",4.4,https://kasa.com/properties/stile-downtown-los-angeles-by-kasa,139,Los Angeles,CA
Beverly Hills Plaza Hotel & Spa,"10300 Wilshire Blvd, Los Angeles, CA 90024, USA",4.3,https://www.beverlyhillsplazahotel.com/,176,Los Angeles,CA
Hollywood Inn Suites Hotel,"1030 W El Segundo Blvd, Gardena, CA 90247, USA",3.8,https://www.hollywoodsuiteshotel.com/,204,Los Angeles,CA
"The Ritz-Carlton, Los Angeles","900 W Olympic Blvd, Los Angeles, CA 90015, USA",4.6,https://www.ritzcarlton.com/en/hotels/laxlz-the-ritz-carlton-los-angeles/overview/?scid=f2ae0541-1279-4f24-b197-a979c79310b0,109,Los Angeles,CA
Kimpton Hotel Wilshire,"6317 Wilshire Blvd, Los Angeles, CA 90048, USA",4.1,https://www.hotelwilshire.com/?&cm_mmc=WEB-_-KI-_-AMER-_-EN-_-EV-_-Google%20Business%20Profile-_-DD-_-wilshire,189,Los Angeles,CA
Aventura Hotel,"1020 Fedora St, Los Angeles, CA 90006, USA",4.2,http://theaventurahotel.com/,130,Los Angeles,CA
Banana Bungalow Hollywood Hotel & Hostel,"5920 Hollywood Blvd, Hollywood, CA 90028, USA",4.1,http://www.bananabungalows.com/,118,Los Angeles,CA
"The Laura Hotel, Houston Downtown, Autograph Collection","1070 Dallas St, Houston, TX 77002, USA",4.3,https://www.marriott.com/en-us/hotels/houkd-the-laura-hotel-houston-downtown-autograph-collection/overview/?scid=f2ae0541-1279-4f24-b197-a979c79310b0,190,Houston,TX
The Lancaster Hotel,"701 Texas Ave, Houston, TX 77002, USA",4.7,https://thelancaster.com/,134,Houston,TX
"C. Baldwin, Curio Collection by Hilton","400 Dallas St, Houston, TX 77002, USA",3.9,https://www.cbaldwinhotel.com/?SEO_id=GMB-AMER-QQ-HOUCUQQ&y_source=1_MTI4NDEyMjEtNzE1LWxvY2F0aW9uLndlYnNpdGU%3D,198,Houston,TX
"InterContinental Houston, an IHG Hotel","6750 Main St, Houston, TX 77030, USA",4.4,https://www.ihg.com/intercontinental/hotels/us/en/houston/houit/hoteldetail?cm_mmc=GoogleMaps-_-IC-_-US-_-HOUIT,195,Houston,TX
"Thompson Houston, by Hyatt","1717 Allen Pkwy, Houston, TX 77019, USA",4.4,https://www.hyatt.com/thompson-hotels/en-US/iahth-thompson-houston?src=corp_lclb_google_seo_iahth&%3Futm_source=google&utm_medium=organic&utm_campaign=lmr,200,Houston,TX
Hyatt Place Houston-North,"300 United Leuva Cir, Houston, TX 77060, USA",3.4,https://www.hyatt.com/hyatt-place/en-US/houza-hyatt-place-houston-north?src=corp_lclb_google_seo_houza&%3Futm_source=google&utm_medium=organic&utm_campaign=lmr,120,Houston,TX
DoubleTree by Hilton Hotel Houston - Greenway Plaza,"6 E Greenway Plaza, Houston, TX 77046, USA",3.8,https://www.hilton.com/en/hotels/hougwdt-doubletree-houston-greenway-plaza/?SEO_id=GMB-AMER-DT-HOUGWDT&y_source=1_MTM3Mjc2Ny03MTUtbG9jYXRpb24ud2Vic2l0ZQ%3D%3D,142,Houston,TX
JW Marriott Houston by The Galleria,"5150 Westheimer Rd, Houston, TX 77056, USA",4.4,https://www.marriott.com/en-us/hotels/houjw-jw-marriott-houston-by-the-galleria/overview/?scid=f2ae0541-1279-4f24-b197-a979c79310b0,164,Houston,TX
Hyatt Regency Houston/Galleria,"2626 Sage Rd, Houston, TX 77056, USA",4.4,https://www.hyatt.com/hyatt-regency/en-US/hourg-hyatt-regency-houston-galleria?src=corp_lclb_google_seo_hourg&%3Futm_source=google&utm_medium=organic&utm_campaign=lmr,174,Houston,TX
La Colombe d'Or hotel,"3410 Montrose Blvd, Houston, TX 77006, USA",4.6,https://www.lacolombedor.com/,148,Houston,TX
Hyatt Regency San Francisco,"5 Embarcadero Ctr, San Francisco, CA 94111, USA",4.4,https://www.hyatt.com/hyatt-regency/en-US/sfors-hyatt-regency-san-francisco?src=corp_lclb_google_seo_sfors&%3Futm_source=google&utm_medium=organic&utm_campaign=lmr,193,San Francisco,CA
"The Ritz-Carlton, San Francisco","600 Stockton St, San Francisco, CA 94108, USA",4.6,https://www.ritzcarlton.com/en/hotels/sforz-the-ritz-carlton-san-francisco/overview/?scid=f2ae0541-1279-4f24-b197-a979c79310b0,232,San Francisco,CA
HI San Francisco Fisherman's Wharf Hostel,"Building, 240 Fort Mason, San Francisco, CA 94123, USA",4.4,https://www.hiusa.org/find-hostels/california/san-francisco-building240-fortmason/?utm_source=listings&utm_medium=local&utm_campaign=Yext23&utm_term=hostel&utm_content=HI_San_Francisco_Fishermans_Wharf&y_source=1_MTAyMTYxNDgzOS03MTUtbG9jYXRpb24ud2Vic2l0ZQ%3D%3D,193,San Francisco,CA
"FOUND Hotel Carlton, Nob Hill","1075 Sutter St, San Francisco, CA 94109, USA",4.1,https://foundhotels.com/cities/hotel-carlton/,203,San Francisco,CA
San Francisco Proper,"1100 Market Street, Hotel Entrance is at, 45 McAllister St, San Francisco, CA 94102, USA",4.3,https://www.properhotel.com/san-francisco/?utm_source=local-listings&utm_medium=organic&utm_campaign=local-listings,226,San Francisco,CA
Samesun San Francisco,"1475 Lombard St, San Francisco, CA 94123, USA",4.4,http://www.samesun.com/,102,San Francisco,CA
Kasa La Monarca San Francisco,"717 Sutter St, San Francisco, CA 94109, USA",4.3,https://www.kasa.com/properties/kasa-la-monarca-san-francisco?utm_source=Google&utm_medium=nonpaid&utm_campaign=GMB&utm_term=VisitHotelWebsiteButton&utm_content=LMH,215,San Francisco,CA
"Golden Gate Hotel, San Francisco","775 Bush St, San Francisco, CA 94108, USA",4.6,https://goldengatehotel.com/,175,San Francisco,CA
Petite Auberge,"863 Bush St, San Francisco, CA 94108, USA",4.3,https://www.petiteaubergesf.com/,106,San Francisco,CA
Hilton San Francisco Financial District,"750 Kearny St, San Francisco, CA 94108, USA",3.9,https://www.hilton.com/en/hotels/sfofdhf-hilton-san-francisco-financial-district/?SEO_id=GMB-AMER-HH-SFOFDHF&y_source=1_MTIyMDk1Ni03MTUtbG9jYXRpb24ud2Vic2l0ZQ%3D%3D,180,San Francisco,CA
The Chicago Hotel Collection Magnificent Mile Hotel & Suites,"166 E Superior St, Chicago, IL 60611, USA",2.5,https://www.thechicagohotelcollection.com/magnificentmile,127,Chicago,IL
Travelodge by Wyndham Downtown Chicago,"65 E Harrison St, Chicago, IL 60605, USA",3.4,https://www.wyndhamhotels.com/travelodge/chicago-illinois/travelodge-hotel-downtown-chicago/overview?CID=LC:fkqqcjhla7b6gbb:10073&iata=00093796,242,Chicago,IL
Silversmith Hotel Chicago Downtown,"10 S Wabash Ave, Chicago, IL 60603, USA",4.5,https://www.silversmithchicagohotel.com/?utm_source=google&utm_medium=organic&utm_campaign=gbp_listing,223,Chicago,IL
The Villa Toscana Guest House,"3447 N Halsted St, Chicago, IL 60657, USA",4.5,http://thevillatoscana.com/,182,Chicago,IL
Level Chicago - River North,"369 W Grand Ave, Chicago, IL 60654, USA",3.4,https://www.stayinglevel.com/destinations/chicago/river-north/,207,Chicago,IL
"The Langham, Chicago","330 N Wabash Ave, Chicago, IL 60611, USA",4.7,https://www.langhamhotels.com/en/the-langham/chicago/?utm_campaign=tlchi&utm_medium=organic+&utm_source=yext&utm_content=na&utm_id=google_hotel_ads_profile_en_20220628&y_source=1_MTAwNjI1OTUtNzE1LWxvY2F0aW9uLndlYnNpdGU%3D,185,Chicago,IL
The Peninsula Chicago,"108 E Superior St, Chicago, IL 60611, USA",4.7,https://www.peninsula.com/en/chicago/5-star-luxury-hotel-downtown-chicago,245,Chicago,IL
The Chicago Hotel Collection River North,"312 W Chestnut St, Chicago, IL 60610, USA",2.5,https://www.thechicagohotelcollection.com/river-north,192,Chicago,IL
Pendry Chicago,"230 N Michigan Ave, Chicago, IL 60601, USA",4.5,https://www.pendry.com/chicago/,209,Chicago,IL
The Royal Sonesta Chicago Downtown,"71 E Wacker Dr, Chicago, IL 60601, USA",4.2,https://www.sonesta.com/royal-sonesta/il/chicago/royal-sonesta-chicago-downtown,247,Chicago,IL
Caesars Palace,"3570 S Las Vegas Blvd, Paradise, NV 89109, USA",4.5,https://www.caesars.com/caesars-palace?utm_campaign=google&utm_source=google&utm_medium=local&utm_term=CLV&utm_content=hotel&y_source=1_NDM2Njg2Ny03MTUtbG9jYXRpb24ud2Vic2l0ZQ==,238,Las Vegas,NV
MGM Grand,"3799 S Las Vegas Blvd, Las Vegas, NV 89109, USA",4.4,https://mgmgrand.mgmresorts.com/en.html,145,Las Vegas,NV
Luxor Hotel & Casino,"3900 S Las Vegas Blvd, Las Vegas, NV 89119, USA",4.1,https://luxor.mgmresorts.com/en.html?ecid=GMB_LX_HO,229,Las Vegas,NV
Planet Hollywood Las Vegas Resort & Casino,"3667 Las Vegas Blvd S, Las Vegas, NV 89109, USA",4.3,https://www.caesars.com/planet-hollywood?utm_campaign=google&utm_source=google&utm_medium=local&utm_term=PlanetHollywoodResortandCasino&utm_content=hotel&y_source=1_NDM2Njg5Ny03MTUtbG9jYXRpb24ud2Vic2l0ZQ==,208,Las Vegas,NV
Flamingo Las Vegas,"3555 Las Vegas Blvd S, Las Vegas, NV 89109, USA",4,https://www.caesars.com/flamingo-las-vegas?utm_campaign=google&utm_source=google&utm_medium=local&utm_term=FLV&utm_content=hotel&y_source=1_NDM2Njg1OC03MTUtbG9jYXRpb24ud2Vic2l0ZQ==,236,Las Vegas,NV
Bellagio Hotel & Casino,"3600 S Las Vegas Blvd, Las Vegas, NV 89109, USA",4.7,https://bellagio.mgmresorts.com/en.html?ecid=GMB_BE_HO,80,Las Vegas,NV
Paris Las Vegas,"3655 S Las Vegas Blvd, Las Vegas, NV 89109, USA",4.4,https://www.caesars.com/paris-las-vegas?utm_campaign=google&utm_source=google&utm_medium=local&utm_term=ParisLasVegas&utm_content=hotel&y_source=1_NDM2Njg4NS03MTUtbG9jYXRpb24ud2Vic2l0ZQ==,229,Las Vegas,NV
Harrah's Las Vegas,"3475 Las Vegas Blvd S, Las Vegas, NV 89109, USA",4,https://www.caesars.com/harrahs-las-vegas?utm_campaign=gmb&utm_source=google&utm_medium=local&utm_term=LAS&utm_content=hotel&y_source=1_NDM2Njg1MC03MTUtbG9jYXRpb24ud2Vic2l0ZQ%3D%3D,131,Las Vegas,NV
"The STRAT Hotel, Casino & Tower","2000 Las Vegas Blvd S, Las Vegas, NV 89104, USA",4,https://thestrat.com/?utm_source=gmb&utm_medium=yext,122,Las Vegas,NV
Excalibur Hotel & Casino,"3850 S Las Vegas Blvd, Las Vegas, NV 89109, USA",4.1,https://excalibur.mgmresorts.com/en.html?ecid=GMB_EX_HO,163,Las Vegas,NV
South Beach Hotel,"236 21st St, Miami Beach, FL 33139, USA",3.8,http://www.southbeachhotel.com/?utm_source=local-directories&utm_medium=organic&utm_campaign=travelclick-localconnect,172,Miami,FL
Hotel Trouvail Miami Beach,"3101 Indian Creek Dr, Miami Beach, FL 33140, USA",4.3,https://www.hoteltrouvailmiamibeach.com/?utm_source=google&utm_medium=organic&utm_campaign=gbp_listing,141,Miami,FL
Hilton Miami Downtown,"1601 Biscayne Blvd, Miami, FL 33132, USA",4.2,https://www.hilton.com/en/hotels/miadthf-hilton-miami-downtown/?SEO_id=GMB-AMER-HH-MIADTHF&y_source=1_MTIyMDgwMC03MTUtbG9jYXRpb24ud2Vic2l0ZQ%3D%3D,229,Miami,FL
The Meridian Hotel,"418 Meridian Ave, Miami Beach, FL 33139, USA",4.2,https://themeridianmiami.com/,184,Miami,FL
The Cove by Renzzi,"534 Washington Ave, Miami Beach, FL 33139, USA",3.6,https://thecovebyrenzzi.com/book-now/,100,Miami,FL
Century Hotel,"140 Ocean Dr, Miami Beach, FL 33139, USA",3.5,http://www.centurymiamibeach.com/,178,Miami,FL
Casa Ocean,"334 Ocean Dr, Miami Beach, FL 33139, USA",4.5,https://www.casahotelsgroup.com/casa-ocean,152,Miami,FL
Miami River Inn,"437 SW 2nd St, Miami, FL 33130, USA",4.1,,137,Miami,FL
The Palms Hotel & Spa,"3025 Collins Ave, Miami Beach, FL 33140, USA",4.4,https://www.thepalmshotel.com/?utm_source=google&utm_medium=organic&utm_campaign=business-listing,131,Miami,FL
"Royal Palm South Beach Miami, a Tribute Portfolio Resort","1545 Collins Ave, Miami Beach, FL 33139, USA",3.9,https://www.marriott.com/en-us/hotels/miatx-royal-palm-south-beach-miami-a-tribute-portfolio-resort/overview/?scid=f2ae0541-1279-4f24-b197-a979c79310b0,186,Miami,FL
Omni Dallas Hotel,"555 S Lamar St, Dallas, TX 75202, USA",4.5,https://www.omnihotels.com/hotels/dallas?utm_source=gmblisting&utm_medium=organic,197,Dallas,TX
"The Ritz-Carlton, Dallas","2121 McKinney Ave, Dallas, TX 75201, USA",4.7,https://www.ritzcarlton.com/en/hotels/dalrz-the-ritz-carlton-dallas/overview/?scid=f2ae0541-1279-4f24-b197-a979c79310b0,220,Dallas,TX
Hilton Garden Inn Downtown Dallas,"1600 Pacific Ave, Dallas, TX 75201, USA",4.2,https://www.hilton.com/en/hotels/dalpagi-hilton-garden-inn-downtown-dallas/?SEO_id=GMB-AMER-GI-DALPAGI&y_source=1_MjcyMzA5NC03MTUtbG9jYXRpb24ud2Vic2l0ZQ%3D%3D,102,Dallas,TX
Aloft Dallas Downtown,"1033 Young St, Dallas, TX 75202, USA",4.2,https://www.marriott.com/en-us/hotels/daldl-aloft-dallas-downtown/overview/?scid=f2ae0541-1279-4f24-b197-a979c79310b0,164,Dallas,TX
"Crowne Plaza Dallas Downtown, an IHG Hotel","1015 Elm St, Dallas, TX 75202, USA",2.6,https://www.ihg.com/crowneplaza/hotels/us/en/dallas/dalem/hoteldetail?cm_mmc=GoogleMaps-_-CP-_-US-_-DALEM,199,Dallas,TX
CANVAS Hotel,"1325 Botham Jean Blvd, Dallas, TX 75215, USA",4.1,https://www.canvashoteldallas.com/,148,Dallas,TX
"Crowne Plaza Dallas Love Field - Med Area, an IHG Hotel","7050 N Stemmons Fwy, Dallas, TX 75247, USA",3.4,https://www.ihg.com/crowneplaza/hotels/us/en/dallas/dalmt/hoteldetail?cm_mmc=GoogleMaps-_-CP-_-US-_-DALMT,208,Dallas,TX
Rosewood Mansion on Turtle Creek,"2821 Turtle Creek Blvd, Dallas, TX 75219, USA",4.7,https://www.rosewoodhotels.com/en/mansion-on-turtle-creek-dallas,105,Dallas,TX
"Thompson Dallas, by Hyatt","205 N Akard St, Dallas, TX 75201, USA",4.4,https://www.hyatt.com/thompson-hotels/en-US/dfwth-thompson-dallas?src=corp_lclb_google_seo_dfwth&%3Futm_source=google&utm_medium=organic&utm_campaign=lmr,90,Dallas,TX
Comfort Suites NW Dallas Near Love Field,"2287 W Northwest Hwy, Dallas, TX 75220, USA",3.6,https://www.choicehotels.com/texas/dallas/comfort-suites-hotels/tx627?mc=llgoxxpx,93,Dallas,TX
Motto by Hilton Washington DC City Center,"627 H St NW, Washington, DC 20001, USA",4.4,https://www.hilton.com/en/hotels/wasuaua-motto-washington-dc-city-center/?SEO_id=GMB-AMER-UA-WASUAUA&y_source=1_MTYyODg3ODQtNzE1LWxvY2F0aW9uLndlYnNpdGU%3D,135,Washington DC,DC
Washington Plaza Hotel,"10 Thomas Cir NW, Washington, DC 20005, USA",4.2,https://www.washingtonplazahotel.com/?utm_source=google&utm_medium=organic&utm_campaign=gbp_listing,163,Washington DC,DC
Omni Shoreham Hotel,"2500 Calvert St NW, Washington, DC 20008, USA",4.2,https://www.omnihotels.com/hotels/washington-dc-shoreham?utm_source=gmblisting&utm_medium=organic,215,Washington DC,DC
Capital Hilton,"1001 16th St NW, Washington, DC 20036, USA",4.3,https://www.hilton.com/en/hotels/dcashhh-capital-hilton/?SEO_id=GMB-AMER-HH-DCASHHH&y_source=1_MTIyMDc2NC03MTUtbG9jYXRpb24ud2Vic2l0ZQ%3D%3D,178,Washington DC,DC
Hilton Garden Inn Washington DC/U.S. Capitol,"1225 First St NE, Washington, DC 20002, USA",3.8,https://www.hilton.com/en/hotels/dcanmgi-hilton-garden-inn-washington-dc-us-capitol/?SEO_id=GMB-AMER-GI-DCANMGI&y_source=1_MjA4MjE4Ni03MTUtbG9jYXRpb24ud2Vic2l0ZQ%3D%3D,239,Washington DC,DC
Hyatt Place Washington DC/US Capitol,"33 New York Ave NE, Washington, DC 20002, USA",3.7,https://www.hyatt.com/hyatt-place/en-US/waszd-hyatt-place-washington-dc-us-capitol?src=corp_lclb_google_seo_waszd&%3Futm_source=google&utm_medium=organic&utm_campaign=lmr,248,Washington DC,DC
citizenM Washington DC Capitol,"550 School St SW, Washington, DC 20024, USA",4.2,https://www.citizenm.com/hotels/united-states/washington-dc/washington-dc-capitol-hotel?utm_source=google&utm_medium=Yext&y_source=1_NDkyNzM5MTctNzE1LWxvY2F0aW9uLndlYnNpdGU%3D,196,Washington DC,DC
"The Westin Washington, D.C. City Center","1400 M St NW, Washington, DC 20005, USA",4.1,https://www.marriott.com/en-us/hotels/wascw-the-westin-washington-dc-city-center/overview/?scid=f2ae0541-1279-4f24-b197-a979c79310b0,182,Washington DC,DC
Sofitel Washington DC Lafayette Square,"806 15th St NW, Washington, DC 20005, USA",4.4,http://sofitel.accor.com/hotels/3293?merchantid=seo-maps-US-3293&sourceid=aw-cen&utm_source=google+Maps&utm_medium=seo+maps&utm_campaign=seo+maps&utm_term=Sofitel-Launch,199,Washington DC,DC
Generator Washington DC,"1900 Connecticut Ave NW, Washington, DC 20009, USA",4.3,https://staygenerator.com/hotels/washington-dc?utm_source=google-my-business&utm_medium=organic&utm_campaign=hostel-washington,220,Washington DC,DC
Hyatt Regency Orlando,"9801 International Dr, Orlando, FL 32819, USA",4.6,https://www.hyatt.com/hyatt-regency/en-US/mcoro-hyatt-regency-orlando?src=corp_lclb_google_seo_mcoro&%3Futm_source=google&utm_medium=organic&utm_campaign=lmr,156,Orlando,FL
Rosen Inn International,"7600 International Dr, Orlando, FL 32819, USA",4.1,https://roseninn7600.com/?utm_source=kiksmedia,104,Orlando,FL
Best Western Orlando Gateway Hotel,"7299 Universal Blvd, Orlando, FL 32819, USA",4,https://www.bworlando.com/,209,Orlando,FL
SureStay Plus By Best Western Orlando International Drive,"5859 American Way, Orlando, FL 32819, USA",3.6,https://www.bestwestern.com/en_US/book/hotel-rooms.55151.html?iata=90000026&ssob=BLSSH0004G&cid=BLSSH0004G:google:gmb:55151,166,Orlando,FL
Rosen Inn at Pointe Orlando,"9000 International Dr, Orlando, FL 32819, USA",4.1,https://www.roseninn9000.com/?utm_source=kiksmedia,194,Orlando,FL
"Garnet Inn & Suites, Orlando","8820 S Orange Blossom Trl, Orlando, FL 32809, USA",3,http://www.garnetinn.com/orlando/,113,Orlando,FL
Universal Endless Summer Resort - Dockside Inn and Suites,"7125 Universal Blvd, Orlando, FL 32819, USA",4.4,https://www.universalorlando.com/web/en/us/places-to-stay/universals-endless-summer-resort-dockside-inn-and-suites,175,Orlando,FL
DoubleTree by Hilton Hotel at the Entrance to Universal Orlando,"5780 Major Blvd, Orlando, FL 32819, USA",4.1,https://www.hilton.com/en/hotels/mcoundt-doubletree-at-the-entrance-to-universal-orlando/?SEO_id=GMB-AMER-DT-MCOUNDT&y_source=1_MTM3Mjc1Ni03MTUtbG9jYXRpb24ud2Vic2l0ZQ%3D%3D,135,Orlando,FL
"Holiday Inn Express & Suites Nearest Universal Orlando, an IHG Hotel","5605 Major Blvd, Orlando, FL 32819, USA",4,https://www.ihg.com/holidayinnexpress/hotels/us/en/orlando/mcomb/hoteldetail?cm_mmc=GoogleMaps-_-EX-_-US-_-MCOMB,223,Orlando,FL
Comfort Suites Near Universal Orlando Resort,"5617 Major Blvd, Orlando, FL 32819, USA",4.3,https://www.choicehotels.com/florida/orlando/comfort-suites-hotels/fl616?mc=llgoxxpx,176,Orlando,FL
Hilton San Diego Bayfront,"1 Park Blvd, San Diego, CA 92101, USA",4.3,https://www.hilton.com/en/hotels/sancchh-hilton-san-diego-bayfront/?SEO_id=GMB-AMER-HH-SANCCHH&y_source=1_MTIyMDc1MS03MTUtbG9jYXRpb24ud2Vic2l0ZQ%3D%3D,143,San Diego,CA
The Dana on Mission Bay,"1710 W Mission Bay Dr, San Diego, CA 92109, USA",4.3,https://www.thedana.com/,120,San Diego,CA
The Westgate Hotel,"1055 Second Ave, San Diego, CA 92101, USA",4.4,https://www.westgatehotel.com/,122,San Diego,CA
Samesun Ocean Beach - San Diego,"4961 Newport Ave, San Diego, CA 92107, USA",4.6,https://samesun.com/ocean-beach/,130,San Diego,CA
The Sofia Hotel,"150 W Broadway, San Diego, CA 92101, USA",4,http://thesofiahotel.com/,225,San Diego,CA
Wyndham Garden San Diego near SeaWorld,"3737 Sports Arena Blvd, San Diego, CA 92110, USA",3.3,https://www.wyndhamhotels.com/wyndham-garden/san-diego-california/wyndham-garden-san-diego-near-seaworld/overview?CID=LC:46q62bu8edfbx3y:45033&iata=00093796,139,San Diego,CA
Alma San Diego,"1047 Fifth Ave, San Diego, CA 92101, USA",4.2,,110,San Diego,CA
Hilton San Diego/Del Mar,"15575 Jimmy Durante Blvd, Del Mar, CA 92014, USA",4.2,https://www.hilton.com/en/hotels/sandmhf-hilton-san-diego-del-mar/?SEO_id=GMB-AMER-HH-SANDMHF&y_source=1_MTIyMDc5OC03MTUtbG9jYXRpb24ud2Vic2l0ZQ%3D%3D,194,San Diego,CA
California Dreams Hostel - Ocean Beach,"3790 Udall St, San Diego, CA 92107, USA",4.8,http://www.californiadreamshostel.com/,87,San Diego,CA
Manchester Grand Hyatt San Diego,"1 Market Pl, San Diego, CA 92101, USA",4.5,https://www.hyatt.com/grand-hyatt/en-US/sanrs-manchester-grand-hyatt-san-diego?src=corp_lclb_google_seo_sanrs&%3Futm_source=google&utm_medium=organic&utm_campaign=lmr,105,San Diego,CA
Hilton Hawaiian Village Waikiki Beach Resort,"2005 Kālia Rd, Honolulu, HI 96815, USA",4.2,https://www.hilton.com/en/hotels/hnlhvhh-hilton-hawaiian-village-waikiki-beach-resort/?SEO_id=GMB-AMER-HH-HNLHVHH&y_source=1_NzIxNzUzLTcxNS1sb2NhdGlvbi53ZWJzaXRl,121,Honolulu,HI
Royal Grove Waikiki,"151 Uluniu Ave, Honolulu, HI 96815, USA",3.5,https://www.royalgrovewaikiki.com/?utm_source=google&utm_medium=organic&utm_campaign=business-listing,95,Honolulu,HI
Waikiki Malia,"2211 Kūhiō Ave., Honolulu, HI 96815, USA",4,http://www.waikikimalia.com/?utm_source=local-listings&utm_medium=organic&utm_campaign=local-listings,145,Honolulu,HI
Ohia Waikiki Studio Suites,"2280 Kūhiō Ave., Honolulu, HI 96815, USA",3.2,https://www.ohiawaikiki.com/?utm_source=GMB&utm_medium=listing&utm_campaign=GMB,185,Honolulu,HI
OUTRIGGER Waikīkī Paradise Hotel,"150 Kaʻiulani Ave, Honolulu, HI 96815, USA",4,https://www.outrigger.com/hawaii/oahu/ohana-waikiki-east-by-outrigger,158,Honolulu,HI
‘Alohilani Resort Waikiki Beach,"2490 Kalākaua Ave, Honolulu, HI 96815, USA",4.2,https://www.alohilaniresort.com/,210,Honolulu,HI
Ramada Plaza by Wyndham Waikiki,"1830 Ala Moana Blvd, Honolulu, HI 96815, USA",4,https://www.wyndhamhotels.com/ramada/honolulu-hawaii/ramada-plaza-waikiki/overview?CID=LC:wmcic5n98gs1g0r:35226&iata=00093796,98,Honolulu,HI
Waikiki Monarch Hotel,"444 Niu St, Honolulu, HI 96815, USA",3.4,http://waikikimonarchhotel.com/,244,Honolulu,HI
"The Laylow, Autograph Collection","2299 Kūhiō Ave., Honolulu, HI 96815, USA",4.5,https://www.marriott.com/en-us/hotels/hnlak-the-laylow-autograph-collection/overview/?scid=f2ae0541-1279-4f24-b197-a979c79310b0,149,Honolulu,HI
Courtyard Waikiki Beach,"400 Royal Hawaiian Ave, Honolulu, HI 96815, USA",3.7,https://www.marriott.com/en-us/hotels/hnlow-courtyard-waikiki-beach/overview/?scid=f2ae0541-1279-4f24-b197-a979c79310b0,186,Honolulu,HI
Hotel Theodore,"1531 7th Ave, Seattle, WA 98101, USA",4.2,https://www.hoteltheodore.com/,223,Seattle,WC
Hotel Max,"620 Stewart St, Seattle, WA 98101, USA",4.1,https://www.hotelmaxseattle.com/,86,Seattle,WC
Hyatt Regency Seattle,"808 Howell St, Seattle, WA 98101, USA",4.6,https://www.hyatt.com/hyatt-regency/en-US/sears-hyatt-regency-seattle?src=corp_lclb_google_seo_sears&%3Futm_source=google&utm_medium=organic&utm_campaign=lmr,217,Seattle,WC
Travelodge by Wyndham Seattle By The Space Needle,"200 6th Ave N, Seattle, WA 98109, USA",3.3,https://www.wyndhamhotels.com/travelodge/seattle-washington/travelodge-seattle-by-the-space-needle/overview?CID=LC:fkqqcjhla7b6gbb:07033&iata=00093796,174,Seattle,WC
Hilton Garden Inn Seattle Downtown,"1821 Boren Ave, Seattle, WA 98101, USA",4.1,https://www.hilton.com/en/hotels/seabagi-hilton-garden-inn-seattle-downtown/?SEO_id=GMB-AMER-GI-SEABAGI&y_source=1_MjQ0Mjg0Mi03MTUtbG9jYXRpb24ud2Vic2l0ZQ%3D%3D,185,Seattle,WC
The Edgewater Hotel,"2411 Alaskan Wy, Seattle, WA 98121, USA",4.4,https://www.edgewaterhotel.com/?utm_source=gmb-hotel&utm_medium=organic&utm_campaign=gmb,110,Seattle,WC
Seattle Marriott Waterfront,"2100 Alaskan Wy, Seattle, WA 98121, USA",4.3,https://www.marriott.com/en-us/hotels/seawf-seattle-marriott-waterfront/overview/?scid=f2ae0541-1279-4f24-b197-a979c79310b0,102,Seattle,WC
Executive Hotel Pacific,"400 Spring St, Seattle, WA 98104, USA",3.5,http://executivehotelseattle.com/,139,Seattle,WC
Kimpton Palladian Hotel,"2000 2nd Ave #100, Seattle, WA 98121, USA",4.3,https://www.palladianhotel.com/?&cm_mmc=WEB-_-KI-_-AMER-_-EN-_-EV-_-Google%20Business%20Profile-_-DD-_-Palladian,189,Seattle,WC
"Holiday Inn Seattle Downtown - Lake Union, an IHG Hotel","211 Dexter Ave N, Seattle, WA 98109, USA",3.9,https://www.ihg.com/holidayinn/hotels/us/en/seattle/seasc/hoteldetail?cm_mmc=GoogleMaps-_-HI-_-US-_-SEASC,215,Seattle,WC
